<?xml version="1.0" encoding="UTF-8"?>
<schema xmlns="http://www.w3.org/2001/XMLSchema"
	targetNamespace="http://by.htp.basumatarau.normalCatalog/news"
	xmlns:tns="http://by.htp.basumatarau.normalCatalog/news">

	<element name="news">
		<complexType>
			<sequence minOccurs="1" maxOccurs="unbounded">
				<element name="newsItem" type="tns:NewsItem"></element>
			</sequence>	
		</complexType>
	</element>
	
	<complexType name="NewsItem">
		<sequence minOccurs="1" maxOccurs="unbounded">
			<choice>
				<element name="movie" type="tns:Movie" />
				<element name="book" type="tns:Book" />
				<element name="cd" type="tns:CD" />
			</choice>
		</sequence>
		<attribute name="category" type="string" use="required" />
	</complexType>
	
	<complexType name="Movie">
		<group ref="tns:newsContent" />
		<attribute name="id" type="int" use="required" />
	</complexType>
	
	<complexType name="Book">
		<group ref="tns:newsContent" />
		<attribute name="id" type="int" use="required" />
	</complexType>

	<complexType name="CD">
		<group ref="tns:newsContent" />
		<attribute name="id" type="int" use="required" />
	</complexType>

	<group name="newsContent">
		<sequence>
			<element name="newsName" type="string" />
			<element name="provider" type="tns:Provider" />
			<element name="dateOfIssue" type="string" />
			<element name="newsBody" type="string" />
		</sequence>
	</group>
	
	<complexType name="Provider">
		<simpleContent>
			<extension base="string">
				<attribute name="author" type="string" use="optional"/>
				<attribute name="authors" type="string" use="optional"/>
			</extension>
		</simpleContent>
	</complexType>
	
</schema>